{
  "schema_version": 1,
  "set_index": 0,
  "exercise_id": "squat",
  "weight_kg": null,
  "end_reason": "still",
  "partial_reps": 1,
  "fps": 15.0,
  "frames": [
    {
      "t_ms": 0,
      "kp": [
        0.3,
        0.1,
        0.9,
        0.32,
        0.145,
        0.9,
        0.34,
        0.19,
        0.9,
        0.36,
        0.235,
        0.9,
        0.38,
        0.28,
        0.9,
        0.4,
        0.325,
        0.9,
        0.42,
        0.37,
        0.9,
        0.44,
        0.415,
        0.9,
        0.46,
        0.46,
        0.9,
        0.48,
        0.505,
        0.9,
        0.5,
        0.55,
        0.9,
        0.52,
        0.595,
        0.9,
        0.54,
        0.64,
        0.9,
        0.56,
        0.685,
        0.9,
        0.58,
        0.73,
        0.9,
        0.6,
        0.775,
        0.9,
        0.62,
        0.82,
        0.9
      ]
    },
    {
      "t_ms": 67,
      "kp": [
        0.301,
        0.1,
        0.9,
        0.321,
        0.145,
        0.9,
        0.341,
        0.19,
        0.9,
        0.361,
        0.235,
        0.9,
        0.381,
        0.28,
        0.9,
        0.401,
        0.325,
        0.9,
        0.421,
        0.37,
        0.9,
        0.441,
        0.415,
        0.9,
        0.461,
        0.46,
        0.9,
        0.481,
        0.505,
        0.9,
        0.501,
        0.55,
        0.9,
        0.521,
        0.595,
        0.9,
        0.541,
        0.64,
        0.9,
        0.561,
        0.685,
        0.9,
        0.581,
        0.73,
        0.9,
        0.601,
        0.775,
        0.9,
        0.621,
        0.82,
        0.9
      ]
    },
    {
      "t_ms": 133,
      "kp": [
        0.302,
        0.1,
        0.9,
        0.322,
        0.145,
        0.9,
        0.342,
        0.19,
        0.9,
        0.362,
        0.235,
        0.9,
        0.382,
        0.28,
        0.9,
        0.402,
        0.325,
        0.9,
        0.422,
        0.37,
        0.9,
        0.442,
        0.415,
        0.9,
        0.462,
        0.46,
        0.9,
        0.482,
        0.505,
        0.9,
        0.502,
        0.55,
        0.9,
        0.522,
        0.595,
        0.9,
        0.542,
        0.64,
        0.9,
        0.562,
        0.685,
        0.9,
        0.582,
        0.73,
        0.9,
        0.602,
        0.775,
        0.9,
        0.622,
        0.82,
        0.9
      ]
    }
  ],
  "reps": [
    {
      "rep_index": 0,
      "start_ms": 20,
      "end_ms": 1820,
      "tempo_ms": 1800,
      "range_deg": 78.4,
      "quality": null,
      "lowering_ms": 900,
      "rising_ms": 900,
      "flags": []
    },
    {
      "rep_index": 1,
      "start_ms": 2400,
      "end_ms": 4300,
      "tempo_ms": 1900,
      "range_deg": 52.1,
      "quality": null,
      "lowering_ms": 1000,
      "rising_ms": 900,
      "flags": [
        {
          "rule_id": "depth",
          "severity": "form",
          "rep_index": 1
        }
      ]
    }
  ]
}
